0 Giddy Phelps Touches Gold for First Time,Michael Phelps won the gold medal in the 400 individual medley and set a world record in a time of 4 minutes 8.26 seconds.
0 Frail Pope Celebrates Mass at Lourdes,LOURDES, France - A frail Pope John Paul II, breathing heavily and gasping at times, celebrated an open-air Mass on Sunday for several hundred thousand pilgrims, many in wheelchairs, at a shrine to the Virgin Mary that is associated with miraculous cures.    At one point he said help me in Polish while struggling through his homily in French...
0 Another Major Non-Factor,Another major, another disappointment for Tiger Woods, the No. 1 ranked player in the world who has not won a major championship since his triumph at the 2002 U.S. Open.
0 Promoting a Shared Vision,As Michael Kaleko kept running into people who were getting older and having more vision problems, he realized he could do something about it.
0 Natalie Coughlin Wins 100M Backstroke (AP),AP - American Natalie Coughlin won Olympic gold in the 100-meter backstroke Monday night. Coughlin, the only woman ever to swim under 1 minute in the event, finished first in 1 minute, 0.37 seconds. Kirsty Coventry of Zimbabwe, who swims at Auburn University in Alabama, earned the silver in 1:00.50. Laure Manaudou of France took bronze in 1:00.88.
0 Jackson Squares Off With Prosecutor,SANTA MARIA, Calif. - Fans of Michael Jackson erupted in cheers Monday as the pop star emerged from a double-decker tour bus and went into court for a showdown with the prosecutor who has pursued him for years on child molestation charges...
0 Live: Olympics day four,Richard Faulds and Stephen Parry are going for gold for Great Britain on day four in Athens.
0 Capacity Crowds at Beach Volleyball Rock the Joint, ATHENS (Reuters) - At the beach volleyball, the 2004  Olympics is a sell-out, foot-stomping success.
0 U.S. Misses Cut in Olympic 100 Free,ATHENS, Greece - Top American sprinters Jason Lezak and Ian Crocker missed the cut in the Olympic 100-meter freestyle preliminaries Tuesday, a stunning blow for a country that had always done well in the event.    Pieter van den Hoogenband of the Netherlands and Australian Ian Thorpe advanced to the evening semifinal a day after dueling teenager Michael Phelps in the 200 freestyle, won by Thorpe...
0 Kederis proclaims innocence,Olympic champion Kostas Kederis today left hospital ahead of his date with IOC inquisitors claiming his innocence and vowing:  quot;After the crucifixion comes the resurrection. quot; ...
0 Olympic history for India, UAE,An Indian army major shot his way to his country #39;s first ever individual Olympic silver medal on Tuesday, while in the same event an member of Dubai #39;s ruling family became the first ever medallist from the United Arab Emirates. 
0 Edwards Banned from Games - Source, ATHENS (Reuters) - World 100 meters champion Torri Edwards  will miss the Athens Olympics after her appeal against a  two-year drugs ban was dismissed on Tuesday, a source told  Reuters.
0 Iliadis, Tanimoto win judo golds,Ilias Iliadis of Greece thrilled the home crowd Tuesday, beating Roman Gontyuk of Ukraine to win the gold medal in the 81-kilogram class. 
0 Buckeyes have lots to replace but are brimming with optimism,There are remarkable similarities between the 2004 Ohio State Buckeyes and those that won the national championship just two years ago. 
0 Women stumble to silver,ATHENS -- The mistakes were so minor. Carly Patterson #39;s foot scraping the lower of the uneven bars. Courtney Kupets #39; tumbling pass that ended here instead of there. Mohini Bhardwaj #39;s slight stumble on the beam. 
0 Notable quotes Tuesday at the Athens Olympics, quot;It hurt like hell. I could see (Thorpe) coming up. But when I was breathing, I saw my team going crazy -- and that really kept me going. quot; ...
0 Security scare as intruder dives in,A CANADIAN husband #39;s love for his wife has led to a tightening of security at all Olympic venues in Athens. 
0 Team USA barely wins, but struggles not all players #39; fault,Now that everybody in and around USA Basketball has breathed a huge sigh of relief, let #39;s not get carried away. 
0 UPI NewsTrack Sports,-- The United States men #39;s basketball team capped off a big day for the USA by fighting off Greece for a vital win, 77-71.  quot;They played with heart, quot; said Coach Larry Brown.  quot;That #39;s all you can ask. quot; ...
0 US Men Have Right Touch in Relay Duel Against Australia,THENS, Aug. 17 - So Michael Phelps is not going to match the seven gold medals won by Mark Spitz. And it is too early to tell if he will match Aleksandr Dityatin, the Soviet gymnast who won eight total medals in 1980. But those were not the ...
0 United Arab Emirates trap shooter secures nation #39;s first Olympic gold,Sheik Ahmed bin Hashr Al-Maktoum earned the first-ever Olympic medal for the United Arab Emirates when he took home the gold medal in men #39;s double trap shooting on Tuesday in Athens. 
0 China Sighs in Relief as Yao Scores High,BEIJING (Reuters) - China breathed a measured sigh of relief after the skills of its basketball giant Yao Ming dwarfed New Zealand to sweep his team nearer to their goal of reaching the Athens Olympics semi-finals. 
0 Greek sprinters arrive at IOC hearing,ATHENS (Reuters) - Greek sprinters Costas Kenteris and Katerina Thanou have arrived at an Athens hotel for an International Olympic Committee (IOC) hearing into their missed doped tests, a saga that has shamed and angered the Olympic host ...
0 Hamm hopes to get on a roll,Paul Hamm takes another shot at history tonight, when he'll try to become the first American to win the Olympic men's all-around in gymnastics.
0 Greek sprinters quit to end Games scandal,ATHENS (Reuters) - Greece #39;s two top athletes have pulled out of the Athens Olympics and apologised to the Greek people for a scandal over missed dope tests that has tarnished the Games #39; return to their birthplace. 
0 Phelps Eyes Fourth Gold, ATHENS (Reuters) - A weary Michael Phelps targeted his  fourth Olympic gold medal in Athens, turning his attention on  Wednesday to the 200 meters individual medley and settling for  the second-fastest overall time in the heats.
0 Afghan women make brief Olympic debut,Afghan women made a short-lived debut in the Olympic Games on Wednesday as 18-year-old judo wildcard Friba Razayee was defeated after 45 seconds of her first match in the under-70kg middleweight. 
0 Olympics: Emotional Zijlaard-van Moorsel defends time trial title,ATHENS : Dutch cycling great Leontien Zijlaard-van Moorsel emotionally defended her Olympic time trial gold medal here. 
0 Dutch cyclist defends Olympic gold,AMSTERDAM  Cyclist Leontien Zijlaard-Van Moorsel won the first gold medal for the Netherlands at the Athens Olympic Games on Wednesday. 
0 Today in Athens,Leontien Zijlaard-van Moorsel of the Netherlands wipes a tear after winning the gold medal in the women #39;s road cycling individual time trial at the Vouliagmeni Olympic Centre in Athens on Wednesday. 
0 Greek sprinters quit Games,ATHENS (Reuters) - Greece #39;s top two sprinters have quit the Olympic Games after submitting their country to six days of embarrassment in a hide-and-seek contest with anti-doping enforcers. 
0 Crowd Inspires Greek Beach Volleyballers; U.S. Duo Ousted, ATHENS (Reuters) - A roaring crowd helped inspire Greece's  top women's beach volleyball team to trounce China on Wednesday  and reach the next round.
0 Hamilton Wins Cycling Time Trial Event,THENS, Aug. 18  Tyler Hamilton had bruises splotched all over his back, painful souvenirs of a Tour de France gone terribly wrong. 
0 Britain #39;s Olympic medal total takes sudden turn for the better,Great Britain #39;s performances in the Olympic Games made a dramatic and unexpected improvement yesterday as they won a silver and three bronze medals. They were also guaranteed at least a silver medal in badminton #39;s mixed doubles. 
0 British athletics appoint psychologist for 2008 Olympics,British athletics chiefs have appointed sports psychologist David Collins as Performance Director to produce medal winners at the 2008 Beijing Olympics.
0 Olympic Daily Preview - Thursday, August 19,Athens, Greece (Sports Network) - Wednesday night it was Paul Hamm #39;s turn to shine for the United States, as he won the gold medal in the men #39;s all-around competition. Will Thursday produce a sweep for the US at the Olympics? ...
0 Brazil beats Haiti in goodwill soccer game,The boys from Brazil beat Haiti #39;s national soccer team Wednesday in a friendly goodwill game 6-0. The game was the brainchild of Brazilian President Luiz Inacio Lula da Silva, who was on hand in the Haitian capital for the historical match. 
0 Tennis: Roddick and Williams ousted,ATHENS Shell-shocked Americans Andy Roddick and Venus Williams joined already-beaten men #39;s top seed Roger Federer in the favourites #39;exodus from the Olympic tennis tournament on Wednesday. 
0 Scandal won #39;t go away,ATHENS -- It was telling yesterday that the majority of the dozens of journalists who asked questions and attended a news conference into a Greek doping scandal were mostly Canadian. Question after question came from Canadians. We were all there, I think, ...
0 A shot in the arm for all,OLYMPIA, Greece -- A brilliant idea, taking the shot put back to the birthplace of the Olympic Games, proving, if nothing else, that everything old really can become new again. 
0 Ali gives Iraq fighting chance,The back of his shirt told the story last night at the Peristeri Olympic Boxing Hall.
0 Olympics: Hansen still strong enough to take bronze,Every ounce of his energy was expended, leaving an empty fuel tank. But, even in a depleted state, Brendan Hansen found a way to bolster his ever-growing swimming legacy. 
0 American Aaron Peirsol Wins Gold on Appeal, ATHENS (Reuters) - Aaron Peirsol won his second gold medal  at the Athens Olympics Thursday after winning an appeal against  his disqualification from the men's 200 meter backstroke.
0 Carly Patterson Wins the Women's All-Round, ATHENS (Reuters) - Carly Patterson upstaged Russian diva  Svetlana Khorkina to become the first American in 20 years to  seize the women's Olympic gymnastics all-round gold medal on  Thursday.
0 Olympics: Olympic weightlifting reels as six more lifters fail drug tests,ATHENS : Weightlifting was reeling from the latest crisis to hit the perennially drug-tainted sport here as six more athletes were kicked out of the Olympics for failing dope tests. 
0 Sprint is chock full of potential heros,It would be nice to see this week #39;s 100-meter sprint as simply the best footrace of all time. We could witness four sub-10-second sprints for the first time ever. It would be nice to watch with raised eyebrows instead of furrowed ones. It ...
0 Liu brings China 4th gold in weightlifting at Athens Games,ATHENS, Aug. 19 (Xinhuanet) -- Chinese Hercules Liu Chunhong Thursday lifted three world records on her way to winning the women #39;s 69kg gold medal at the Athens Olympics, the fourth of the power sport competition for China. 
0 Battling Davenport through,Lindsay Davenport continued her dominant recent run and reached the last eight of the Cincinnati Open with a 4-6 6-4 6-1 win over Lilia Osterloh. 
0 Badminton pair want more,Nathan Robertson says there is no reason why he and badminton partner Gail Emms should not win the next Olympics.
0 Agassi cruises into Washington Open ATP quarter-finals,WASHINGTON, Aug. 19 (Xinhuanet) -- Andre Agassi cruised into quarter-finals in Washington Open tennis with a 6-4, 6-2 victory over Kristian Pless of Denmark here on Thursday night. 
0 Carly Patterson Wins Gymnastics All-Around Gold, ATHENS (Reuters) - Carly Patterson upstaged Russian diva  Svetlana Khorkina to become the first American in 20 years to  win the women's Olympic gymnastics all-round gold medal on  Thursday.
0 3 US boxers punched out of Games,Athens -- Vanes Martirosyan became the second American to bow out of the Olympic boxing tournament Thursday when he was defeated 20-11 by Lorenzo Aragon of Cuba in their welterweight bout at 152 pounds. 
0 French Take Gold, Bronze in Single Kayak,ATHENS, Greece - Winning on whitewater runs in the family for Frenchman Benoit Peschier, though an Olympic gold is something new. Peschier paddled his one-man kayak aggressively but penalty free in both his semifinal and final runs on the manmade Olympic ...
0 Swimming: Phelps Wins Gold, Pulls Out of Relay, ATHENS (Reuters) - Michael Phelps, who has won five gold  medals in the Olympic pool, said Friday he was pulling out of  Saturday's 4x100 meter medley relay final to give team mate Ian  Crocker the chance to swim.
0 Seven seize,ATHENS -- He was behind at the start. He was behind at the turn. He was behind for 99.99 of the 100 meters. His head was behind Ian Crocker's head at the finish. And yet somehow last night, Michael Phelps won again -- for the fourth and final time in an individual race at these Olympics.
0 Italian PM #39;s transplant confirmed,After days of speculation sparked by the white bandanna worn by Mr Berlusconi on holiday in Sardinia, Piero Rosati said the results of the operation would show in a couple of months.
0 More gold for Britain as Wiggins strikes,Bradley Wiggins has given Britain their second Olympic cycling gold medal in two days, winning the men #39;s 4-km individual pursuit.
0 Strongwoman hoists 100th gold for Chinese delegation,Tang Gonghong lifted a world record to claim in Athens the 100th Olympic gold for China since its participation in 1984 Olympic Games on Saturday when 
0 Wall St.'s Nest Egg - the Housing Sector, NEW YORK (Reuters) - If there were any doubts that we're  still living in the era of the stay-at-home economy, the rows  of empty seats at the Athens Olympics should help erase them.
0 Lithuanians deliver NBA stars another Olympic basketball dunking (AFP),AFP - Lithuania defeated the United States 94-90 in an Olympic men's basketball preliminary round game, only the fourth loss in 115 Olympic starts for the defending champions.
0 Glory Comes Amid Empty Seats and Closed Shutters,HERE in Old Europe, people install shutters outside their windows to keep out the heat, the pollution, the daylight, the noise. They also lock the shutters tight when they go away on holiday.
0 Unknown Nesterenko Makes World Headlines (Reuters),Reuters - Belarus' Yuliya Nesterenko won the top\women's athletics gold medal at the Olympics on Saturday,\triumphing over a field stripped of many big names because of\doping woes to win the 100 meters.
0 Belarus #39; Nesterenko fastest in women #39;s 100m first round,Belarus #39; Yuliya Nesterenko became the fastest woman to qualify for the women #39;s 100 meters second round at the Olympic Games here on Friday.
0 Greek weightlifter awaits verdict,Greek weightlifter Leonidas Sampanis will find out on Sunday if he is to be stripped of his medal.
0 Work done, Phelps basks in gold glor,And on the eighth day, Michael Phelps actually got to rest. After swimming some 18 races in Olympic competition, Phelps was a mere spectator last night, watching his teammates cap a terrific week for the US swim team.
0 Games hammered with controversy,The International Gymnastics Federation suspended three judges yesterday for a mistake they made in scoring the men #39;s all-around final, but said results would not be changed and Paul Hamm of the United States would keep his gold medal.
0 Admirers look to 2008,But as far as swim greats Rowdy Gaines and John Naber are concerned, what Phelps did in Athens exceeded what Spitz did in Munich in 1972.
0 Emmons loses gold medal after aiming at wrong target,American shooter Matt Emmons fired at the wrong target on his final shot Sunday, blowing a commanding lead in the Olympic 50-meter three-position rifle event and allowing Jia Zhanbo of China to take the gold.
0 U.S. Softball Team Wins, Closes in on Gold,ATHENS, Greece - Right now, the Americans aren't just a Dream Team - they're more like the Perfect Team. Lisa Fernandez pitched a three-hitter Sunday and Crystl Bustos drove in two runs as the Americans rolled to their eighth shutout in eight days, 5-0 over Australia, putting them into the gold medal game...
0 Men Set for Sizzling Duel in 100 Meters,ATHENS, Greece - The preliminaries in the 100 meters were perhaps just a sample of what's to come Sunday, when a talented group of qualifiers - including Americans Shawn Crawford, Justin Gatlin and defending champion Maurice Greene - will try to turn their competition into the fastest show at the Athens Games.    Five men broke 10 seconds in qualifying Saturday, led by Crawford's time of 9.89...
0 Ulmer storms to gold,New Zealand #39;s Sarah Ulmer stormed to gold in the women #39;s individual pursuit in a new world record time. Ulmer, fourth in Sydney four years ago, beat Australia #39;s Katie Mactier in a time of three minutes 24.
0 Cycling: Ulmer #39;s scorching times in secret rides,New Zealand #39;s star cyclist, Sarah Ulmer, last week rode under world record time twice in an hour during a secret training session in France.
0 U.S. Gymnasts Win 3 Medals; Hamm Angry (AP),AP - Terin Humphrey and Annia Hatch got silver. Courtney Kupets got bronze. And Paul Hamm got mad. The United States upped its gymnastics medal haul to seven Sunday night, the most since the Americans won 16 at the boycotted Los Angeles Games in 1984. And they might not be finished yet.
0 Noguchi Wins Marathon,BULLETIN&lt;br&gt;BC-OLY--Women's Marathon RUN,0058&lt;br&gt;BULLETIN&lt;br&gt;    ATHENS, Greece (AP)  --  Mizuki Noguchi of Japan won the marathon Sunday in 2 hours, 26 minutes, 20 seconds.
0 Gatlin Sprints from Unknown to Olympic Gold, ATHENS (Reuters) - American Justin Gatlin roared from  virtual unknown to win the blue ribband Olympic men's 100  meters race on Sunday, upstaging more illustrious rivals in a  pulsating final.
0 Exhausted Massu Outlasts Fish for Gold, ATHENS (Reuters) - An exhausted Nicolas Massu reeled in  Mardy Fish in five tortuous sets on Sunday to win Chile their  second gold medal at an Olympic Games less than 24 hours after  helping them to their first.
0 Davenport wins in Cincinnati,American Lindsay Davenport captured her fourth consecutive title, beating second seed Vera Zvonareva 6-3, 6-2 in the final of the \$US170,000 WTA Cincinnati Open on Sunday.
0 Colin Jackson: Hard lessons learnt in the human laboratory,Yesterday #39;s Olympics treated us to the two extremes of athletics, the endurance race which tests the body to its limits, and the heavyweight showdown, the sprint, which is in the mind.
0 ROUNDUP: Franchitti overcomes pit mishap for IRL win,FOUNTAIN, Colo. -- Dario Franchitti shook off a potentially dangerous pit mishap to win the IRL #39;s Honda 225 Sunday at Pikes Peak International Raceway.
0 Roundup: Pleasantly Perfect takes Pacific Classic,Favored Pleasantly Perfect took charge down the stretch to win by a length in the 14th running of the \$1 million Pacific Classic yesterday at Del Mar. Pleasantly 
0 US women avoid disaster, advance,ATHENS -- Preliminary-round elimination would have been a disaster for the United States women. Desperate for a victory, the Americans avoided embarrassment by finally playing like a gold medal contender -- and like a team.
0 Radcliffe withdrawal not due to injury,World record holder Paula Radcliffe #39;s tearful withdrawal from the women #39;s Olympic marathon yesterday was not due to injury, the British team says.
0 Sports: Graham says he sent the syringe,ATHENS, Greece Track coach Trevor Graham admits he was the person who triggered the BALCO investigation. Graham says he #39;s the one who anonymously sent a syringe of THG to the US Anti-Doping Agency.
0 U.S. Men's Hoops Team Finally Gets a Rout,ATHENS, Greece - The Americans got a taste of what it was like in the good ol' days. They finally played an opponent they were able to beat easily, routing Angola 89-53 Monday in their final preliminary game of the Olympic men's basketball tournament...
0 Wariner Succeeds Johnson as 400 Meter Champion, ATHENS (Reuters) - American 400 meters champion Jeremy  Wariner succeeded Michael Johnson as the Olympic gold medallist  Monday with a personal best of 44.00 seconds.
0 US men #39;s basketball routs Angola,Athens, Greece (Sports Network) - Tim Duncan led a balanced American attack with 15 points and seven rebounds, as the United States men #39;s basketball team completed the preliminary round with a resounding 89-53 victory over winless Angola.
0 Patterson gets silver on balance beam,Athens, Greece (Sports Network) - American Carly Patterson, the women #39;s all- around champion at the Summer Games, added another medal on Monday night with a silver in the balance beam competition.
0 Gatlin sprints from unknown to 100m gold,Reuters Athens Aug 23: American Justin Gatlin roared from virtual unknown to win the blue ribband Olympic mens 100 metres race yesterday, upstaging defending champion Maurice Greene and other more illustrious rivals.
0 Marathon meltdown,THE winner smiled and then vomited. The roaring favourite collapsed and couldn #39;t finish. The Australian contemplated surrender, staggered on and didn #39;t regret it.
0 Japanese joy and British tears,IT WAS the night of the longest race and the shortest, a night of distress for Britain #39;s Paula Radcliffe and delight for America #39;s Justin Gatlin.
0 US beats Germany 2-1 in OT, to face Brazil in women #39;s soccer final,Heather O #39;Reilly, minutes after missing a wide open net, scored in the ninth minute of overtime Monday to give the United States a 2-1 victory over World Cup champion Germany and a place in Thursday #39;s gold-medal game.
0  #39;Marathon mouse #39; doubles stamina,Scientists in the United States have genetically engineered mice which can run twice as far as normal before becoming exhausted. The researchers say their finding could lead to drugs or gene 
0 Marathoning mice could have Olympian effects on obesity,A molecular switch known to regulate fat metabolism appears to prevent obesity and turns laboratory mice into marathon runners, a Salk Institute study has found.
0 Dominant US captures gold with 79th straight win,The US softball team completed its scorched-earth run through the Olympics on Monday with a 5-1 win over Australia, America #39;s third straight gold medal.
0 Pressure points,ATHENS -- The booing went on for nearly 10 minutes while Paul Hamm, chalked up and ready, waited beneath the horizontal bar last night.  quot;Wow, quot; Hamm told his twin brother Morgan.  quot;I've never seen this before. quot;
0 11th-hour highlights too late,NBC's prime-time Olympic coverage is taped and shaped, the television version of a Reader's Digest condensed book. We get all the US highlights, the big news stories, and a well-edited drama building to the 11 p.m. hour. It's a formula that's been proven to hold an audience and pull ratings. The big downside: You have to stay up until midnight ...
1 Prediction Unit Helps Forecast Wildfires (AP),AP - It's barely dawn when Mike Fitzpatrick starts his shift with a blur of colorful maps, figures and endless charts, but already he knows what the day will bring. Lightning will strike in places he expects. Winds will pick up, moist places will dry and flames will roar.
1 Open Letter Against British Copyright Indoctrination in Schools,The British Department for Education and Skills (DfES) recently launched a Music Manifesto campaign, with the ostensible intention of educating the next generation of British musicians. Unfortunately, they also teamed up with the music industry (EMI, and various artists) to make this popular. EMI has apparently negotiated their end well, so that children in our schools will now be indoctrinated about the illegality of downloading music.The ignorance and audacity of this got to me a little, so I wrote an open letter to the DfES about it. Unfortunately, it's pedantic, as I suppose you have to be when writing to goverment representatives. But I hope you find it useful, and perhaps feel inspired to do something similar, if or when the same thing has happened in your area.
1 Loosing the War on Terrorism,\\Sven Jaschan, self-confessed author of the Netsky and Sasser viruses, is\responsible for 70 percent of virus infections in 2004, according to a six-month\virus roundup published Wednesday by antivirus company Sophos.\\The 18-year-old Jaschan was taken into custody in Germany in May by police who\said he had admitted programming both the Netsky and Sasser worms, something\experts at Microsoft confirmed. (A Microsoft antivirus reward program led to the\teenager's arrest.) During the five months preceding Jaschan's capture, there\were at least 25 variants of Netsky and one of the port-scanning network worm\Sasser.\\Graham Cluley, senior technology consultant at Sophos, said it was staggeri ...\\
1 FOAFKey: FOAF, PGP, Key Distribution, and Bloom Filters,\\FOAF/LOAF  and bloom filters have a lot of interesting properties for social\network and whitelist distribution.\\I think we can go one level higher though and include GPG/OpenPGP key\fingerpring distribution in the FOAF file for simple web-of-trust based key\distribution.\\What if we used FOAF and included the PGP key fingerprint(s) for identities?\This could mean a lot.  You include the PGP key fingerprints within the FOAF\file of your direct friends and then include a bloom filter of the PGP key\fingerprints of your entire whitelist (the source FOAF file would of course need\to be encrypted ).\\Your whitelist would be populated from the social network as your client\discovered new identit ...\\
1 E-mail scam targets police chief,Wiltshire Police warns about phishing after its fraud squad chief was targeted.
