1 Card fraud unit nets 36,000 cards,In its first two years, the UK's dedicated card fraud unit, has recovered 36,000 stolen cards and 171 arrests - and estimates it saved 65m.
1 Group to Propose New High-Speed Wireless Format, LOS ANGELES (Reuters) - A group of technology companies  including Texas Instruments Inc. &lt;TXN.N&gt;, STMicroelectronics  &lt;STM.PA&gt; and Broadcom Corp. &lt;BRCM.O&gt;, on Thursday said they  will propose a new wireless networking standard up to 10 times  the speed of the current generation.
1 Apple Launches Graphics Software, Video Bundle, LOS ANGELES (Reuters) - Apple Computer Inc.&lt;AAPL.O&gt; on  Tuesday began shipping a new program designed to let users  create real-time motion graphics and unveiled a discount  video-editing software bundle featuring its flagship Final Cut  Pro software.
1 Dutch Retailer Beats Apple to Local Download Market, AMSTERDAM (Reuters) - Free Record Shop, a Dutch music  retail chain, beat Apple Computer Inc. to market on Tuesday  with the launch of a new download service in Europe's latest  battleground for digital song services.
1 Socialites unite dolphin groups,Dolphin groups, or pods, rely on socialites to keep them from collapsing, scientists claim.
1 Teenage T. rex's monster growth,Tyrannosaurus rex achieved its massive size due to an enormous growth spurt during its adolescent years.
1 Storage, servers bruise HP earnings,update Earnings per share rise compared with a year ago, but company misses analysts' expectations by a long shot.
1 IBM to hire even more new workers,By the end of the year, the computing giant plans to have its biggest headcount since 1991.
1 Sun's Looking Glass Provides 3D View,Developers get early code for new operating system 'skin' still being crafted.
1 IBM Chips May Someday Heal Themselves,New technology applies electrical fuses to help identify and repair faults.
1 Some People Not Eligible to Get in on Google IPO,Google has billed its IPO as a way for everyday people to get in on the process, denying Wall Street the usual stranglehold it's had on IPOs. Public bidding, a minimum of just five shares, an open process with 28 underwriters - all this pointed to a new level of public participation. But this isn't the case.
1 Rivals Try to Turn Tables on Charles Schwab,By MICHAEL LIEDTKE     SAN FRANCISCO (AP) -- With its low prices and iconoclastic attitude, discount stock broker Charles Schwab Corp. (SCH) represented an annoying stone in Wall Street's wing-tipped shoes for decades...
1 News: Sluggish movement on power grid cyber security,Industry cyber security standards fail to reach some of the most vulnerable components of the power grid.\
1 Retailers Vie for Back-To-School Buyers (Reuters),Reuters - Apparel retailers are hoping their\back-to-school fashions will make the grade among\style-conscious teens and young adults this fall, but it could\be a tough sell, with students and parents keeping a tighter\hold on their wallets.
1 Politics an Afterthought Amid Hurricane (AP),AP - If Hurricane Charley had struck three years ago, President Bush's tour through the wreckage of this coastal city would have been just the sort of post-disaster visit that other presidents have made to the scenes of storms, earthquakes, floods and fires.
1 Spam suspension hits Sohu.com shares (FT.com),FT.com - Shares in Sohu.com, a leading US-listed Chinese internet portal, fell more than 10 per cent on Friday after China's biggest mobile phone network operator imposed a one-year suspension on its multimedia messaging services because of customers being sent spam.
1 Dell Exits Low-End China Consumer PC Market, HONG KONG (Reuters) - Dell Inc. &lt;DELL.O&gt;, the world's  largest PC maker, said on Monday it has left the low-end  consumer PC market in China and cut its overall growth target  for the country this year due to stiff competition in the  segment.
1 Vodafone hires Citi for Cesky bid (TheDeal.com),TheDeal.com - The U.K. mobile giant wants to find a way to disentagle the Czech wireless and fixed-line businesses.
1 Dollar Briefly Hits 4-Wk Low Vs Euro, LONDON (Reuters) - The dollar dipped to a four-week low  against the euro on Monday before rising slightly on  profit-taking, but steep oil prices and weak U.S. data  continued to fan worries about the health of the world's  largest economy.
1 Treasuries Slip as Stocks Rally, NEW YORK (Reuters) - U.S. Treasury debt prices slipped on  Monday, though traders characterized the move as profit-taking  rather than any fundamental change in sentiment.
1 Dollar Rises Vs Euro on Asset Flows Data, NEW YORK (Reuters) - The dollar extended gains against the  euro on Monday after a report on flows into U.S. assets showed  enough of a rise in foreign investments to offset the current  account gap for the month.
1 Oracle Overhauls Sales-Side Apps for CRM Suite (NewsFactor),NewsFactor - Oracle (Nasdaq: ORCL) has revamped its sales-side CRM applications in version 11i.10 of its sales, marketing, partner relationship management and e-commerce application.
1 Indian state rolls out wireless broadband,Government in South Indian state of Kerala sets up wireless kiosks as part of initiative to bridge digital divide.
1 Hurricane Survivors Wait for Water, Gas,PUNTA GORDA, Fla. - Urban rescue teams, insurance adjusters and National Guard troops scattered across Florida Monday to help victims of Hurricane Charley and deliver water and other supplies to thousands of people left homeless...
1 China's Red Flag Linux to focus on enterprise,Red Flag Software Co., the company behind China's leading Linux client distribution, plans to focus more on its server operating system and enterprise customers, the company's acting president said.
1 AOL Properties Sign Girafa For Thumbnail Search Images,AOL Properties Sign Girafa For Thumbnail Search Images\\Girafa.com Inc. announced today that the CompuServe, Netscape, AIM and ICQ properties of America Online, Inc., have signed an agreement with Girafa to use Girafa's thumbnail search images as an integrated part of their search results.\\Using Girafa's thumbnail search service, search users can ...
1 Dollar Near Recent Lows, Awaits ZEW/CPI, LONDON (Reuters) - The dollar held steady near this week's  four-week low against the euro on Tuesday with investors  awaiting a German investor confidence survey and U.S. consumer  inflation numbers to shed light on the direction.
1 Intel to delay product aimed for high-definition TVs,SAN FRANCISCO -- In the latest of a series of product delays, Intel Corp. has postponed the launch of a video display chip it had previously planned to introduce by year end, putting off a showdown with Texas Instruments Inc. in the fast-growing market for high-definition television displays.
1 Kmart Swings to Profit in 2Q; Stock Surges (AP),AP - Shares of Kmart Holding Corp. surged 17 percent Monday after the discount retailer reported a profit for the second quarter and said chairman and majority owner Edward Lampert is now free to invest the company's  #36;2.6 billion in surplus cash.
1 Consumers Would Pay In Phone Proposal,A proposal backed by a coalition of telephone carriers would cut billions of dollars in fees owed by long-distance companies to regional phone giants but would allow the regional companies to make up some of the difference by raising monthly phone bills for millions of consumers. &lt;FONT face=verdana,MS Sans Serif,arial,helvetica size=-2\ color=#666666&gt;&lt;B&gt;-The Washington Post&lt;/B&gt;&lt;/FONT&gt;
1 Sneaky Credit Card Tactics,Keep an eye on your credit card issuers -- they may be about to raise your rates.
1 Intel Delays Launch of Projection TV Chip,In another product postponement, semiconductor giant Intel Corp. said it won't be offering a chip for projection TVs by the end of 2004 as it had announced earlier this year.
1 Fund pessimism grows,NEW YORK (CNN/Money) - Money managers are growing more pessimistic about the economy, corporate profits and US stock market returns, according to a monthly survey by Merrill Lynch released Tuesday. 
1 Staples Profit Up, to Enter China Market, NEW YORK (Reuters) - Staples Inc. &lt;A HREF=http://www.investor.reuters.com/FullQuote.aspx?ticker=SPLS.O target=/stocks/quickinfo/fullquote&gt;SPLS.O&lt;/A&gt;, the top U.S.  office products retailer, on Tuesday reported a 39 percent jump  in quarterly profit, raised its full-year forecast and said it  plans to enter the fast-growing Chinese market, sending its  shares higher.
1 Consumer Prices Down, Industry Output Up, WASHINGTON (Reuters) - U.S. consumer prices dropped in July  for the first time in eight months as a sharp run up in energy  costs reversed, the government said in a report that suggested  a slow rate of interest rate hikes is likely.
1 Home Depot Likes High Oil,Rising fuel prices, a bugbear for most of the retail sector, are helping Home Depot (HD:NYSE - news - research), the remodeling giant that reported a surge in second-quarter earnings Tuesday and guided the rest of the year higher. 
1 China cracks down on  quot;phone sex quot; services,BEIJING, Aug. 17 (Xinhuanet) -- China is carrying out a nationwide campaign to crack down on  quot;phone sex quot; services, paralleling another sweeping operation against Internet pornography, Minister of Information Industry Wang Xudong said here Tuesday. 
1 Surviving Biotech's Downturns,Charly Travers offers advice on withstanding the volatility of the biotech sector.
1 Stocks Climb on Drop in Consumer Prices,NEW YORK - Stocks rose for a second straight session Tuesday as a drop in consumer prices allowed investors to put aside worries about inflation, at least for the short term.    With gasoline prices falling to eight-month lows, the Consumer Price Index registered a small drop in July, giving consumers a respite from soaring energy prices...
1 TGn Sync Proposes New WLAN Standard,The battle over home entertainment networking is heating up as a coalition proposes yet another standard for the IEEE #39;s consideration. 
1 Yahoo! Ups Ante for Small Businesses,Web giant Yahoo! is gambling that price cuts on its domain name registration and Web hosting products will make it more competitive with discounters in the space -- which means that small businesses looking to move online get a sweeter deal through ...
1 IBM Buys Two Danish Services Firms,IBM said Tuesday it has acquired a pair of Danish IT services firms as part of its effort to broaden its presence in Scandinavia. As a result of the moves, IBM will add about 3,700 IT staffers to its global head count. Financial terms of ...
1 Motorola and HP in Linux tie-up,Motorola plans to sell mobile phone network equipment that uses Linux-based code, a step forward in network gear makers #39; efforts to rally around a standard. 
1 Microsoft Pushes Off SP2 Release,Microsoft will delay the release of its SP2 update for another week to fix software glitches. But not everyone is quite so eager to install the SP2 update for Windows XP. In fact, many companies have demanded the ability to prevent their ...
1 IBM adds midrange server to eServer lineup,The new IBM Power5 eServer i5 550 also features higher performance and new virtualization capabilities that allow it to run multiple operating systems at once on separate partitions.
1 iPod Comparison,Newsday #146;s Stephen Williams reports on seeing Sony #146;s NW-HD1 audio player in a store:  #147; #145;How #146;s it compare to the iPod? #146; I asked a salesman.  #145;Battery life is a lot longer, up to 30 hours, #146; he said.  #145;The LCD readout is kind of dim, #146; I said.   #146;Battery life is a lot longer, #146; he said.  #145;I understand it can #146;t play MP3 files, #146; I said.  #145;Battery life is a lot longer, #146; he said. #148; Aug 17
1 Mills Grabs \$1B Portfolio; Taubman Likely to Lose Contracts,Mills Corp. agreed to purchase a 50 percent interest in nine malls owned by General Motors Asset Management Corp. for just over \$1 billion, creating a new joint venture between the groups. The deal will extend ...
1 Oil prices bubble to record high,The price of oil has continued its sharp rise overnight, closing at a record high. The main contract in New York, light sweet crude for delivery next month, has closed at a record \$US46.75 a barrel - up 70 cents on yesterday #39;s close. 
1 AMD Ships Notebook Chips,It wasn #39;t the first to go small, and it won #39;t be the biggest producer, but AMD #39;s (Quote, Chart) 64-bit 90-nanometer (nm) chips are expected to make waves in the semiconductor pool. 
1 IBM Seeks To Have SCO Claims Dismissed (NewsFactor),NewsFactor - IBM (NYSE: IBM) has -- again -- sought to have the pending legal claims by The SCO Group dismissed. According to a motion it filed in a U.S. district court, IBM argues that SCO has no evidence to support its claims that it appropriated confidential source code from Unix System V and placed it in Linux.
1 Dollar Stuck, CPI Offers Little Direction, TOKYO (Reuters) - The dollar moved in tight ranges on  Wednesday as most investors shrugged off lower-than-expected  U.S. inflation data and stuck to the view the U.S. Federal  Reserve would continue raising rates.
1 Google Lowers Its IPO Price Range,SAN JOSE, Calif. - In a sign that Google Inc.'s initial public offering isn't as popular as expected, the company lowered its estimated price range to between \$85 and \$95 per share, down from the earlier prediction of \$108 and \$135 per share...
1 Future Doctors, Crossing Borders,Students at the Mount Sinai School of Medicine learn that diet and culture shape health in East Harlem.
1 Oil Sets New Record \$47 on Iraq Threat, LONDON (Reuters) - Oil prices surged to a new high of \$47 a  barrel on Wednesday after a new threat by rebel militia against  Iraqi oil facilities and as the United States said inflation  had stayed in check despite rising energy costs.
1 SEC may put end to quid pro quo (USATODAY.com),USATODAY.com - The Securities and Exchange Commission is expected to vote Wednesday to prohibit mutual fund companies from funneling stock trades to brokerage firms that agree to promote their funds to investors.
1 Real targets iPod with download price cut,RealNetworks has kicked off what it claims is the biggest online music sale in history. For a limited time, every song in the firm #39;s RealPlayer Music Store can be downloaded for 49 cents, with most albums available for \$4.99. 
1 UPDATE: China Mobile 1H Net Up 7.8 On Subscriber Growth,HONG KONG (Dow Jones)--China Mobile (Hong Kong) Ltd. (CHL), the listed unit of China #39;s biggest cellular phone operator, posted Wednesday a 7.8 rise in first-half net profit on a 23 increase in its subscriber base. 
1 Monsanto Says Justice Dept Closes Inquiry, NEW YORK (Reuters) - Monsanto Co. &lt;A HREF=http://www.investor.reuters.com/FullQuote.aspx?ticker=MON.N target=/stocks/quickinfo/fullquote&gt;MON.N&lt;/A&gt; on Wednesday said  the U.S. Justice Department has closed an inquiry into  potential antitrust issues regarding a key ingredient used in  its Roundup herbicide.
1 Cox Communications forms committee to advise on buyout,Cox Communications Inc. #39;s board of directors has formed a special committee of independent directors to consider Cox Enterprises Inc. #39;s proposal to take the company private in a \$8 billion stock buyout. 
1 10 features for a perfect browser,  There are some  great  browsers  out there. But they all seem to have some slight niggles, different for  each, that make it hard for me to kick back and enjoy them.        While there are some projects out there to make browsers more useful for  some specialised purposes  or by bolting on handy  extensions, wouldn't it be great if these people could come up with a  standardised set of nice features like these? A lot of browsers may support  one or two, but I'll bet none have them all.  
1 Cops Test Handheld Fingerprint Reader,Several Minnesota police departments are field testing a handheld device that scans a suspect's fingerprint and digitally checks it against Minnesota's criminal history and fingerprint database.
1 Ross Stores Profit Plummets 40 Percent (AP),AP - Discount retailer Ross Stores Inc. Wednesday said its profit fell about 40 percent in the latest quarter due to problems with a new computer system that limited the company's ability to respond to changes in customer demand.
1 Small computers can have multiple personalities, too,BOSTON The jury is still out on whether a computer can ever truly be intelligent, but there is no question that it can have multiple personalities. It #39;s just a matter of software. We usually think of the processor chip as the brains of a computer. The ...
1 Immigrants settled in big cities, but less likely to find work: StatsCan (Canadian Press),Canadian Press - OTTAWA (CP) - Most of the nearly two million immigrants who arrived in Canada during the 1990s settled in one of the country's 27 census metropolitan areas, but still found it harder to find work than natural-born citizens, Statistics Canada reported Wednesday.
1 Sun postpones September user show,Sun Microsystems Inc. has decided to postpone its September SunNetwork 2004 San Francisco user conference, and is contemplating merging the event with its JavaOne 2005 developer conference, scheduled for the end of June 2005.
1 Oracle launches Business Integlligence 10g,Oracle introduced a new BI platform yesterday, Business Intelligence 10g that rolls up into one solution all of their BI tools. However, more interesting than the nitty-gritty details of what is included is the back story taking place at the same time.
1 Kroger's Profit Up; Price Cuts Weigh, NEW YORK (Reuters) - Kroger Co., the top U.S. grocer, on  Tuesday posted a 29 percent rise in quarterly profit due to  cost controls, but price cuts to lure shoppers caused earnings  to miss Wall Street estimates and shares fell.
1 Microsoft finalises three-year government deal,Hot on the heels of its 10-year strategic partnership with the London Borough of Newham, Microsoft is close to signing a new broad three-year public sector agreement with the government. 
1 Drive maker files counterclaims in patent suit,Cornice blasts Seagate's suit over patents for tiny hard drives used in portable gadgets.
1 HP moves network scanning software into beta,CHICAGO - Hewlett-Packard(HP) has moved its Active Counter Measures network security software into beta tests with a select group of European and North American customers in hopes of readying the product for a 2005 release, an HP executive said at the HP World conference here in Chicago Wednesday.
1 Medtronic Quarterly Earnings Rise, CHICAGO (Reuters) - Medtronic Inc. &lt;A HREF=http://www.investor.reuters.com/FullQuote.aspx?ticker=MDT.N target=/stocks/quickinfo/fullquote&gt;MDT.N&lt;/A&gt; on Wednesday  said its quarterly earnings rose amid brisk demand for devices  that manage irregular heart beats and products used to treat  the spine.
1 Stock Prices Climb Ahead of Google IPO,NEW YORK - Investors shrugged off rising crude futures Wednesday to capture well-priced shares, sending the Nasdaq composite index up 1.6 percent ahead of Google Inc.'s much-anticipated initial public offering of stock.    In afternoon trading, the Dow Jones industrial average gained 67.10, or 0.7 percent, to 10,039.93...
1 Medtronic Quarterly Net Up, CHICAGO (Reuters) - Medtronic Inc. &lt;A HREF=http://www.investor.reuters.com/FullQuote.aspx?ticker=MDT.N target=/stocks/quickinfo/fullquote&gt;MDT.N&lt;/A&gt; on Wednesday  said its quarterly earnings rose on brisk demand for devices  that manage irregular heart beats and products used to treat  the spine.
1 Strong Family Equals Strong Education,Single mothers, poverty were big factors in school performance    HealthDayNews -- American teenagers who live with poor single mothers are more likely to get into trouble at school and have poor marks and are less likely to think they'll go to college, says a Rice University study.    Holly Heard, an assistant professor of sociology, analyzed data from thousands of teens who took part in the National Longitudinal Study of Adolescent Health...
1 NetRatings survey shows broadband users now a majority in US,AUGUST 18, 2004 (IDG NEWS SERVICE) - A majority of US home Internet users now have broadband, according to a survey by NetRatings Inc. 
1 Intuit Posts Wider Loss After Charge (Reuters),Reuters - Intuit Inc. (INTU.O), maker of\the No. 1 U.S. tax presentation software TurboTax, on Wednesday\posted a wider quarterly loss after taking a goodwill\impairment charge during its seasonally weaker fourth quarter.
1 Alaska Wildfires Grow to Record 5 Million Acres (Reuters),Reuters - Wildfires have scorched over\5 million acres in Alaska as of Tuesday, forestry officials\said, a new record that signals possible changes in climate\conditions and the composition of the vast forests.
1 Hurricane center #39;s projection on Charley not far off, data show,FORT LAUDERDALE, Fla. - (KRT) - Despite criticism that it should have better anticipated Hurricane Charley #39;s rapid intensification and quick turn, the National Hurricane Center #39;s forecast wasn #39;t that far off, a preliminary post-mortem shows. 
1 UPDATE 1-J amp;J in talks to buy Guidant - sources,Health care and consumer products maker Johnson  amp; Johnson (JNJ.N: Quote, Profile, Research) is in negotiations to acquire medical-device maker Guidant Corp.
1 AMP shrugs off British debacle,Australian insurer AMP returned to the black in the first half of the year with net profits of A\$378m (150m) after a disastrous foray into Britain pushed it A\$2.16 billion into the red last year. 
1 Lloyds TSB cashes in on VoIP,Lloyds TSB is gearing up to roll out one of the largest converged networks in Europe, a 500m 70,000 phone VoIP infrastructure linking all the bank #39;s branches and cash points.
1 Selling Houston Warts and All, Especially Warts,Descriptions of urban afflictions and images of giant mosquitoes and cockroaches to convey a sense of how Houston is nevertheless beloved by many residents.
1 Credit Suisse to merge CSFB unit into parent,Credit Suisse Group announced plans to merge its Credit Suisse First Boston Securities unit with the rest of the company #39;s operations and cut as many as 300 jobs.
1 Holiday-Shopping Season Remains Sluggish (Reuters),Reuters - U.S. shoppers have kept a tight grip\on their wallets this holiday season with indices on Tuesday\showing sluggish sales in the second week of the  season.
1 Insurer lowers hurricane estimate,Hurricane Charley, the worst storm to hit the US in over a decade, will cost insurers just \$7.4bn, one insurance expert estimates.
1 Hundreds laid off at Fleet offices,Bank of America Corp. yesterday laid off hundreds of workers at Fleet bank branches across the Northeast as the North Carolina bank began to implement its brand of ...
1 NetApp CEO: No Storage Spending Shortfall (TechWeb),TechWeb - Customers are decoupling storage from server purchases, which explains why EMC and NetApp earnings were up and why Sun and HP were flat or down, Warmenhoven says.
1 Justices to debate mail-order wine,Being freelance wine critics may sound like a sweet gig, but Ray and Eleanor Heald have soured on it. Because their home state, Michigan, blocks direct shipments from out-of-state 
1 Oil prices surge to a new high,WASHINGTON -- The price of oil charged to a new high above \$47 a barrel yesterday amid nagging concerns about instability in Iraq, the uncertain fate of Russian petroleum giant Yukos, and the world's limited supply cushion.
1 After Wait, Google Set for Market Debut, NEW YORK (Reuters) - Shares of Google Inc. will make their  Nasdaq stock market debut on Thursday after the year's most  anticipated initial public offering priced far below initial  estimates, raising \$1.67 billion.
1 Bill Clinton Helps Launch Search Engine,Former president Bill Clinton on Monday helped launch a new Internet search company backed by the Chinese government which says its technology uses artificial intelligence to produce better results than Google Inc.
1 Survey: Napster, iTunes beat other download brands (MacCentral),MacCentral - Market research company Ipsos-Insight on Tuesday announced the results of TEMPO, a quarterly survey of digital music behaviors. According to the report, consumers aged 12 and older in the United States were as likely to be aware of Apple Computer Inc.'s iTunes Music Store and Napster 2.0 when it came to recognizing digital music download brands -- each music service registered 20 percent of what TEMPO refers to as top-of-mind awareness.
1 Qantas says record profit not big enough,Australia #39;s flagship carrier Qantas Airways has reported a record annual net profit but warned oil prices threatened its performance, increasing the chance of a hike in ticket price surcharges to offset its fuel bill. 
1 State, drug chains reach agreement,The state of Maine, Rite Aid Corp., and Community Pharmacy LP have agreed to a consent decree placing conditions on the sale of five Community Pharmacy stores to Rite Aid.
1 Most US homes have broadband connections,While the total number of home internet users has reached a plateau in the US, those who do use the internet are adopting broadband at a rapid pace, according to Marc Ryan, senior director of analysis at the audience measurement company. 
1 Caterpillar snaps up another remanufacturer of engines,PEORIA - Caterpillar Inc. said Wednesday it will acquire a South Carolina remanufacturer of engines and automatic transmissions, increasing its US employment base by 500 people. 
1 Qantas wants better tax treatment,MARK COLVIN: Qantas might have posted yet another record profit, but the national carrier #39;s boss, Geoff Dixon, claims earnings are being hampered by unfair subsidies for international carriers allowed to fly in and out of Australia. 
