2 Explosions Echo Throughout Najaf,NAJAF, Iraq - Explosions and gunfire rattled through the city of Najaf as U.S. troops in armored vehicles and tanks rolled back into the streets here Sunday, a day after the collapse of talks - and with them a temporary cease-fire - intended to end the fighting in this holy city...
2 Venezuela Prepares for Chavez Recall Vote,Supporters and rivals warn of possible fraud; government says Chavez's defeat could produce turmoil in world oil market.
2 1994 Law Designed to Preserve Guard Jobs (AP),AP - A 1994 law strengthened job protections for National Guard and Reserve troops called to active duty. Here are major provisions of the Uniformed Services Employment and Reemployment Rights Act (USERRA).
2 Iran Warns Its Missiles Can Hit Anywhere in Israel, TEHRAN (Reuters) - A senior Iranian military official said  Sunday Israel and the United States would not dare attack Iran  since it could strike back anywhere in Israel with its latest  missiles, news agencies reported.
2 Afghan Army Dispatched to Calm Violence,KABUL, Afghanistan - Government troops intervened in Afghanistan's latest outbreak of deadly fighting between warlords, flying from the capital to the far west on U.S. and NATO airplanes to retake an air base contested in the violence, officials said Sunday...
2 Venezuelans Flood Polls, Voting Extended, CARACAS, Venezuela (Reuters) - Venezuelans voted in huge  numbers on Sunday in a historic referendum on whether to recall  left-wing President Hugo Chavez and electoral authorities  prolonged voting well into the night.
2 China Says Taiwan Spy Also Operated in U.S. - Media, BEIJING (Reuters) - Beijing on Monday accused a  Chinese-American arrested for spying for Taiwan of building an  espionage network in the United States, and said he could go on  trial very soon.
2 US fighter squadron to be deployed in South Korea next month (AFP),AFP - A squadron of US Air Force F-15E fighters based in Alaska will fly to South Korea next month for temporary deployment aimed at enhancing US firepower on the Korean peninsula, US authorities said.
2 Restive Maldives eases curfew after rounding up dissidents (AFP),AFP - A curfew in the capital of the Maldives was eased but parliament sessions were put off indefinitely and emergency rule continued following last week's riots, officials and residents said.
2 India's Tata expands regional footprint via NatSteel buyout (AFP),AFP - India's Tata Iron and Steel Company Ltd. took a strategic step to expand its Asian footprint with the announcement it will buy the Asia-Pacific steel operations of Singapore's NatSteel Ltd.
2 Delegates Urge Cleric to Pull Out of Najaf,BAGHDAD, Iraq - Delegates at Iraq's National Conference called on radical Shiite cleric Muqtada al-Sadr to abandon his uprising against U.S. and Iraqi troops and pull his fighters out of a holy shrine in Najaf...
2 UN launches 210-million-dollar appeal for flood-hit Bangladesh (AFP),AFP - The United Nations launched an appeal here for 210 million dollars to help flood victims facing grave food shortages after two-thirds of Bangladesh was submerged, destroying crops and killing more than 700 people.
2 Suspect charged in abduction, sexual assault of 11-year-old girl (Canadian Press),Canadian Press - LANGLEY, B.C. (CP) - Police have arrested a man in the kidnapping and sexual assault of an 11-year-old girl that frightened this suburban Vancouver community last week.
2 Cassini Spies Two Little Saturn Moons (AP),AP - NASA's Cassini spacecraft has spied two new little moons around satellite-rich Saturn, the space agency said Monday.
2 On front line of AIDS in Russia,An industrial city northwest of Moscow struggles as AIDS hits a broader population.
2 Nobel Laureate Decries Stem Cell Limits (AP),AP - A Nobel laureate in medicine said Monday the Bush administration's limits on funding for embryonic stem cell research effectively have stopped the clock on American scientists' efforts to develop treatments for a host of chronic, debilitating diseases.
2 Jury Can Hear of Kobe Accuser's Sex Life (AP),AP - Prosecutors suffered another setback Monday in the Kobe Bryant sexual assault case, losing a last-ditch attempt to keep the NBA star's lawyers from telling jurors about the alleged victim's sex life.
2 North Korea Talks Still On, China Tells Downer (Reuters),Reuters - China has said no date has been set for\working-level talks on the North Korean nuclear crisis and gave\no indication that the meeting has been canceled, Australian\Foreign Minister Alexander Downer said on Tuesday.
2 Last American defector in North Korea agrees to tell story (AFP),AFP - The last surviving American defector to communist North Korea wants to tell his story to put a human face on the Stalinist state which he believes is unfairly vilified abroad, British film-makers said.
2 Kerry Widens Lead in California, Poll Finds (Reuters),Reuters - Democratic challenger John Kerry\has a commanding lead over President Bush in California of 54\percent to 38 percent among likely voters, a poll released on\Tuesday found.
2 Venezuela vote keeps Chavez as president,CARACAS -- Venezuelans voted resoundingly to keep firebrand populist Hugo Chavez as their president in a victory that drew noisy reactions yesterday from both sides in the streets. International observers certified the results as clean and accurate.
2 Jailing of HK democrat in China 'politically motivated' (AFP),AFP - Hong Kong democrats accused China of jailing one of their members on trumped-up prostitution charges in a bid to disgrace a political movement Beijing has been feuding with for seven years.
2 U.S. Brokers Cease-fire in Western Afghanistan, KABUL (Reuters) - The United States has brokered a  cease-fire between a renegade Afghan militia leader and the  embattled governor of the western province of Herat,  Washington's envoy to Kabul said Tuesday.
2 Delegation Is Delayed Before Reaching Najaf,AGHDAD, Iraq, Aug. 17  A delegation of Iraqis was delayed for security reasons today but still intended to visit Najaf to try to convince a rebellious Shiite cleric and his militia to evacuate a shrine in the holy city and end ...
2 Mr Downer shoots his mouth off,Just what Alexander Downer was thinking when he declared on radio last Friday that  quot;they could fire a missile from North Korea to Sydney quot; is unclear. The provocative remark, just days before his arrival yesterday on his second visit to the North Korean ...
2 Sudan vows to restore order to Darfur but calls for African peacekeepers (AFP),AFP - Sudan will take the lead in restoring order to its rebellious Darfur region but needs the support of African peacekeepers and humanitarian aid, Foreign Minister Mustafa Osman Ismail said.
2 Cassini Space Probe Spots Two New Saturn Moons (Reuters),Reuters - Two new moons were spotted around\Saturn by the Cassini space probe, raising the total to 33\moons for the ringed planet, NASA said on Monday.
2 UK charges 8 in terror plot linked to alert in US,LONDON, AUGUST 17: Britain charged eight terror suspects on Tuesday with conspiracy to commit murder and said one had plans that could be used in striking US buildings that were the focus of security scares this month. 
2 SUVs: Live And Let Die,NEW YORK - The newly released traffic crash fatality data have something for everyone in the debate about the safety of sport utility vehicles. 
2 Peace delegation leaves Najaf empty-handed as fighting continues,BAGHDAD, Iraq - A national political conference #39;s bid to end the fighting in the Shiite Muslim holy city of Najaf appeared to have failed Tuesday. 
2 Georgian president calls for international conference on South Ossetia,TBILISI, Georgia  Georgian President Mikhail Saakashvili appealed to world leaders Tuesday to convene an international conference on the conflict in breakaway South Ossetia, where daily exchanges of gunfire threaten to spark ...
2 Shelling, shooting resumes in breakaway Georgian region (AFP),AFP - Georgian and South Ossetian forces overnight accused each other of trying to storm the other side's positions in Georgia's breakaway region of South Ossetia, as four Georgian soldiers were reported to be wounded.
2 Kerry-Kerrey Confusion Trips Up Campaign (AP),AP - John Kerry, Bob Kerrey. It's easy to get confused.
2 Schrder adopts Russian orphan,Three-year-old Victoria, from St Petersburg, has been living at the Schrders #39; family home in Hanover in northern Germany for several weeks. 
2 Sharon orders 1,000 homes in West Bank,Israel announced plans for 1,000 houses in the West Bank yesterday, accelerating the expansion of the settlements. 
2 So. Cal Player Investigated in Sex Assault (AP),AP - At least one member of the top-ranked Southern California football team is under investigation for sexual assault, the Los Angeles Police Department said Tuesday.
2 Bush Promotes His Plan for Missile Defense System,President Bush, in Pennsylvania, said that opponents of a missile defense system were putting the nation's security at risk.
2 Israelis OK new homes in West Bank,A leaked Israeli plan to build 1,000 new Jewish settler homes in the West Bank yesterday sent Bush administration officials scrambling for a response in the sensitive period before November #39;s presidential election. 
2 Britain accuses 8 of terror plot,LONDON - British police charged eight terrorist suspects yesterday with conspiring to commit murder and use radioactive materials, toxic gases, chemicals or explosives to cause  quot;fear or injury. quot; ...
2 Israel kills 5 in strike at Hamas activist,Islamic group #39;s armed wing, the Izz el-Deen al-Qassam Brigades. Doctors said he suffered leg wounds. 
2 Fresh Fighting Shatters Short-Lived Ceasefire Deal,Renewed clashes in South Ossetia, which resulted in death of two Georgian soldiers, erupted late on August 17, several hours after the South Ossetian and Georgian officials agreed on ceasefire. As a result Tbilisi has already announced that it will not ...
2 Karzai Promises Afghans Security for Election (Reuters),Reuters - Afghanistan's President Hamid Karzai\promised Afghans greater security when they go to vote in the\country's first ever democratic election during an independence\day speech on Wednesday.
2 Israel Kills 5 in Attempt to Assassinate Hamas Man, GAZA (Reuters) - A senior Hamas leader survived an Israeli  assassination attempt in the Gaza Strip Wednesday but at least  five other Palestinians were killed in the explosion that tore  through his home.
2 Philippine Rebels Free Troops, Talks in Doubt, PRESENTACION, Philippines (Reuters) - Philippine communist  rebels freed Wednesday two soldiers they had held as prisoners  of war for more than five months, saying they wanted to  rebuild confidence in peace talks with the government.
2 British Terror Suspects Make First Court Appearance, LONDON (Reuters) - British terror suspects charged in a  plot linked to security alerts at financial targets in New  York, New Jersey and Washington made their first court  appearance Wednesday inside a high security prison.
2 North Korea peace efforts in peril,THE international effort to end the North Korean nuclear crisis appears at risk of unravelling, despite Foreign Minister Alexander Downer #39;s high-profile mission to the secretive Stalinist state. 
2 Rebel threat on the roads leaves Katmandu isolated,KATMANDU, Nepal The Nepali capital was largely cut off from the rest of the country on Wednesday after Maoist rebels threatened to attack any vehicles traveling on main roads, in a virtual blockade of Katmandu to press their demands for the release of ...
2 Russia ready to contribute to settlement of South Ossetia conflict: Putin,MOSCOW, Aug. 18 (Xinhuanet) -- Russian President Vladimir Putin said Wednesday that Russia is ready to contribute to a settlement of conflict between Georgia and its separatist province of South Ossetia. 
2 NASA confident of debris solution,Six months before NASA plans to return the shuttle to space, officials think they #39;ve essentially solved the problem that doomed Columbia in 2003 -- debris coming off its fuel 
2 Burundi Police Forcibly Disperse Tutsi Protest,Police in Burundi #39;s capital, Bujumbura, used tear gas to break up a demonstration Wednesday held to protest the massacre of Congolese Tutsi refugees. 
2 Veterans Committee counts for little,The Hall of Fame released the latest Veterans Committee ballot yesterday. As you might (or might not) remember, there #39;s a (nearly) new committee in town.
2 Martin announces major overhaul of key staff in Prime Minister's Office (Canadian Press),Canadian Press - OTTAWA (CP) - Paul Martin announced a major overhaul of his senior staff Wednesday, with several close confidants and one ex-cabinet minister handed major roles in the Prime Minister's Office in a post-election shakeup.
2 Kerry assails Bush troop withdrawal plan (AFP),AFP - Democratic White House hopeful Senator John Kerry warned that President George W. Bush's plan to withdraw 70,000 troops from Europe and Asia would hinder the war on terrorism and embolden North Korea.
2 Iraq cleric 'to end Najaf revolt',Shia cleric Moqtada Sadr reportedly agrees to end an uprising in the holy Iraqi city of Najaf.
2 Stunt pilots to save sun dust,IT PROMISES to be a scene worthy of a science fiction spectacular. A space probe carrying primordial material scooped from outer space starts to plunge towards our planet. But before it can strike, a helicopter flown by a Hollywood stunt ...
2 U.S. Forces Kill 50 Sadr Militia in Baghdad Suburb, BAGHDAD (Reuters) - U.S. forces killed more than 50 Shi'ite  militiamen on Wednesday in a significant advance into a Baghdad  suburb that is a powerbase for radical cleric Moqtada al-Sadr,  the military said.
2 Putin faults Georgia on  #39;90s tactics in 2 regions,TBILISI, Georgia The separatist conflicts in Georgia resulted from the  quot;foolish quot; move by Georgia to strip South Ossetia and Abkhazia of their autonomous status during the Soviet collapse, President Vladimir Putin of Russia was quoted as saying on ...
2 Government gives partial clearance to Bangla tour,The Government today gave a partial go-ahead for the Indian cricket team #39;s tour of Bangladesh for the first Test match beginning on Thursday but its security delegation will go to Chittagong, the other venue, to make an assessment of the threat perception 
2 Arafat urges reforms to rectify his  #39;mistakes #39;,YASSER Arafat, the Palestinian president, made a rare acknowledgement of mistakes under his rule yesterday and urged reforms to end corruption. 
2 UN to begin second airlift of Vietnamese Montagnards (AFP),AFP - The second major airlift of Vietnamese Montagnards who fled to Cambodia's remote jungles after April anti-government protests will begin at the weekend.
2 Nepal Seeks Talks to End Rebel Blockade of Capital, KATHMANDU (Reuters) - The fear of attack kept most vehicles  off roads leading to Nepal's capital for a second day on  Thursday as authorities sought talks to end a siege called by  Maoist insurgents.
2 Bomb found near Berlusconi #39;s villa,Italian Premier Silvio Berlusconi (left) goes for a walk with British Prime Minister Tony Blair and his wife Cherie Blair at Berlusconi #39;s villa, Monday. AP ...
2 Bluetooth flying bot creates buzz,The latest tiny flying robot that could help in search and rescue or surveillance has been unveiled in Japan.
2 Kidnappers threaten to kill western journalist,The kidnappers of an American-French journalist in Iraq have threatened to execute him within 48 hours unless US forces withdraw from the holy city of Najaf. 
2 SA 'mercenaries' plead not guilty,Sixty-six men accused of plotting a coup in Equatorial Guinea deny breaching Zimbabwe's security laws.
2 Explorers Find Ancient City in Remote Peru Jungle (Reuters),Reuters - An ancient walled city complex\inhabited some 1,300 years ago by a culture later conquered by\the Incas has been discovered deep in Peru's Amazon jungle,\explorers said on Tuesday.
2 Abu Ghraib report 'spreads blame',A report on the Abu Ghraib prisoner abuse scandal will blame at least two dozen more people, say US officials.
2 Atlantis Evidence Found in Spain, Ireland,In 360 B.C. the Greek philosopher Plato described an island he called Atlantis. Now contradicting new evidence claims the fabled city-state was based on a real place.
2 Groups Eager to Meet With Bush, Kerry (AP),AP - Organizations representing the nation's 3 million scientists, engineers and doctors have invited both presidential candidates to have a word with them  #151; online.
2 Georgian Troops Leave South Ossetia,The soldiers withdrew from the heights above the Ossetian of capital of Tskhinvali Thursday, turning the area over to peacekeepers. Georgia says three of its soldiers were killed in earlier fighting, while Ossetian authorities say three civilians died ...
2 Scientists Study the Hudson River (AP),AP - Scientists are plunking a series of high-tech sensors into the Hudson River in an effort to unravel mysteries of the murky waterway.
2 Study to Examine Effects of Ship Waste (AP),AP - A team of scientists is traveling a 600-mile stretch of the Inside Passage this month to study the effects of cruise ship waste and other contaminants in Southeast Alaska waters.
2 Genesis Spacecraft Prepares to Return to Earth with a Piece of the Sun,In a dramatic ending that marks a beginning in scientific research, NASA's Genesis spacecraft is set to swing by Earth and jettison a sample return capsule filled with particles of the Sun that may ultimately tell us more about the genesis of our solar system.
2 Darfur warring parties to meet in Nigeria for peace talks (AFP),AFP - Sudan's government and its foes in the Darfur region's rebel movements will meet on Monday for peace talks which mark a last chance for African diplomacy to solve the crisis before the United Nations steps in.
2 Life without numbers in a unique Amazon tribe,11=2. Mathematics doesn #39;t get any more basic than this, but even 11 would stump the brightest minds among the Piraha tribe of the Amazon. 
2 Swap Your PC, or Your President,The producer of ads featuring PC users who switched to Macs is applying the same tactic to political commercials. This time, he'll focus on former backers of President Bush, recruited online, who've changed their political allegiance. By Louise Witt.
2 30,000 More Sudanese Threaten to Cross to Chad -UN (Reuters),Reuters - Some 30,000 Sudanese, victims of fresh\attacks by Arab militia inside Darfur, have threatened to cross\into Chad, the U.N. refugee agency warned on Friday.
2 Don #39;t expect Tiger to relinquish his top ranking without a fight,They #39;re calling Ohio a  quot;battleground state, quot; one of the two or three places likely to decide November #39;s presidential election. On local TV, the Bush and Kerry ads air so frequently that it #39;s easy to forget it #39;s Bob Costas who actually runs the country. 
2 Dogs in Training to Sniff Out Cancer,Experts have trained unwanted dogs into supersniffers that can detect drugs or bombs. Now they're focusing on a new threat #151;prostate cancer.
2 Mood Mixed Among Darfur Rebels Ahead of Talks,CORCHA CAMP, Sudan (Reuters) - A Sudanese rebel commander in a camp in Darfur tells his troops he is hoping for peace. But just a few hours march away, young men say they are convinced Sudan wants to drive them off the land. 
2 Sadr Militiamen Still in Control of Iraq Shrine, NAJAF, Iraq (Reuters) - Rebel Shi'ite fighters appeared  still to be in control of the Imam Ali mosque in the Iraqi city  Najaf early on Saturday, but the whereabouts of their leader,  the fiery cleric Moqtada al-Sadr, were unknown.
2 Republican Convention Light on Stars (AP),AP - The Republicans will have one sure Hollywood star for their convention  #151; California Gov. Arnold Schwarzenegger  #151; along with performers to keep the country music fans happy. But they'll be hard-pressed to match the Democratic convention's appeal to young voters led by Ben Affleck.
2 Rosetta Mission Sniffing a Comet,The European Rosetta mission will sample a comet as it tries to harpoon and hook onto its surface. A specially designed oven will cook the comet in analogy to sniffing for recognizable elements.
2 Soldiers Kill Palestinian Near Gaza-Israel Fence,Israeli soldiers shot and killed a Palestinian as he approached a security fence between Israel and the Gaza Strip, Israeli military sources said on Saturday.
2 Militia, Shiite Leaders Bicker Over Shrine,NAJAF, Iraq - Militants loyal to radical Shiite cleric Muqtada al-Sadr kept their hold on a revered shrine, and clashes flared in Najaf on Saturday, raising fears that a resolution to the crisis in the holy city could collapse amid bickering between Shiite leaders.    The clashes between U.S...
2 West Mulls Boundries for African Fighting (AP),AP - As the month-end deadline nears for Sudan to disarm the mostly Arab pro-government militias in Darfur, the United Nations and Western powers are in a dilemma over how far to go to stop the killing in an African country.
2 Chavez victory confirmed,Caracas, Venezuela - The results of an audit support the official vote count showing that President Hugo Chavez won this month #39;s recall referendum in Venezuela, the head of the Organization of American States said Saturday.
2 Pakistani troops raid two terrorist hideouts,PAKISTANI troops backed by artillery and aircraft attacked two suspected terrorist hideouts near the rugged Afghan border yesterday, killing and wounding a number of militants, Pakistan army and security officials said.
2 Fatah hopes Barghouti would take back candidacy,Fatah, the mainstream Palestinian movement, hopes that its former West Bank leader Marwan Barghouti would take back his candidacy for the Jan. 9 presidential election.
2 Blasts hit Bangladesh party rally,A series of grenade blasts has rocked an opposition party rally in the Bangladesh capital, Dhaka, killing at least 13 people. There were seven or eight explosions at the Awami League headquarters, as leader Sheikh Hasina addressed a crowd.
2 Around the world,The bombing of a UN election office in Afghanistan that injured six policemen drew calls from a UN union Friday for a withdrawal of staffers from the embattled nation.
2 Arson attack on Jewish centre in Paris (AFP),AFP - A Jewish social centre in central Paris was destroyed by fire overnight in an anti-Semitic arson attack, city authorities said.
2 A Founding Father?,Give the guy some credit. Tung Chee-hwa, Hong Kong #39;s embattled Chief Executive, gets precious little of it from his people these daysand heaps of 
2 Three People Killed at Afghan Checkpoint, KABUL (Reuters) - A man and two women were shot dead by  Afghan and U.S.-led troops after their vehicle ran through a  checkpoint on Saturday, a U.S. military statement said.
2 Putin Visits Chechnya Ahead of Election (AP),AP - Russian President Vladimir Putin made an unannounced visit to Chechnya on Sunday, laying flowers at the grave of the war-ravaged region's assassinated president a week before elections for a new leader.
2 Munch masterpiece 'The Scream' stolen from Oslo museum (AFP),AFP - A version of Edvard Munch's masterpiece The Scream and another famous painting by the great Norwegian artist were stolen from an Oslo museum by armed and hooded robbers, police said.
2 Labor: Anti-Peres meetings scheduled for Sunday,Labor members have scheduled two  #39;rebel #39; anti-Peres conferences for Sunday, one to be headed by MK Matan Vilnai and the second by MK Binyamin Ben-Eliezer.
2 More Evidence for Past Water on Mars,Summary - (Aug 22, 2004) NASA #39;s Spirit rover has dug up plenty of evidence on slopes of  quot;Columbia Hills quot; that water once covered the area.
2 Three people killed at Afghan checkpoint,A man and two women were shot dead by Afghan and US-led troops after their vehicle ran through a checkpoint on Saturday, a US military statement said.
2 Karzai set for visit to Pakistan,Afghan President Hamid Karzai is to visit Pakistan to discuss fighting terror and boosting trade.
2 Senate Republican Unveils Plan for Intelligence,The plan would give the proposed national director responsibility for intelligence-gathering of the C.I.A. and the Pentagon.
2 Afghan-Coalition Soldiers Kill 3, Wound 2 at Checkpoint,Coalition forces in Afghanistan say that three people were killed and two others critically wounded when their pickup truck tried to run a checkpoint in the province of Ghazni.
2 U.S. Plane Attacks Najaf Rebels as Tanks Near Shrine, NAJAF, Iraq (Reuters) - A U.S. AC-130 gunship attacked  Shi'ite militia positions in the holy Iraqi city of Najaf early  on Monday after tanks reinforced the siege of a shrine at the  center of a nearly three-week insurgency.
2 Soldiers face Abu Ghraib hearings,Four US soldiers charged with abusing Iraqi prisoners  are set to face pre-trial hearings in Germany.
2 Prototype copter-cam: Here, there, everywhere,It can only remain aloft for three minutes but weighs less than an empty soft drink can -- and it can take and transmit pictures in flight.
2 Plane crashes into Venezuelan mountain killing 25,: A military plane crashed into a mountain in Central Venezuela, killing 25 people, including five children, the Air Force rescue team said in a statement.
2 Africa brings Sudanese parties to the table as UN sanctions loom (AFP),AFP - The African Union will bring Sudan's warring government and rebel armies into talks with regional power-brokers aimed at heading off a mounting humanitarian crisis in the province of Darfur.
2 Taiwan votes on leaner parliament,A vote is due to be held in Taiwan on plans to halve the number of seats in the island's famously heated legislature.
2 Chavez rejects CD as opposition,Venezuela #39;s President Hugo Chavez has announced that he will no longer recognize the Democratic Coordination or CD as the opposition coalition.
