1 Oil Hits New High Over \$48 as Iraq Violence Flares, LONDON (Reuters) - Oil prices struck a fresh record above  \$48 a barrel on Thursday, spurred higher by renewed violence in  Iraq and fresh evidence that strong demand growth in China and  India has not been slowed yet by higher energy costs.
1 Economic Indicators Declined in July,A closely watched measure of future economic activity fell in July for the second consecutive month, reinforcing evidence that the nation's financial recovery is slackening.
1 Colgate to Cut 4,400 Jobs, Shut Plants, NEW YORK (Reuters) - Colgate-Palmolive Co. &lt;A HREF=http://www.investor.reuters.com/FullQuote.aspx?ticker=CL.N target=/stocks/quickinfo/fullquote&gt;CL.N&lt;/A&gt; will cut  about 4,400 jobs, or 12 percent of its work force, and close  nearly a third of its factories under a restructuring, the  consumer products company said on Tuesday.
1 Drugstore Offers New Wave of Disposable Cameras, NEW YORK (Reuters) - Pharmacy chain CVS Corp. on Thursday  said it would offer the world's first disposable digital camera  with a bright color viewing screen that allows consumers to  instantly preview pictures.
1 Ciena Posts a Loss, Forecasts Flat Sales,&lt;p&gt;&lt;/p&gt;&lt;p&gt; By Deborah Cohen&lt;/p&gt;&lt;p&gt; CHICAGO (Reuters) - Telecommunications equipment makerCiena Corp. &lt;CIEN.O&gt; on Thursday reported a wider loss for thefiscal third quarter due to slack demand and forecast sales inthe current quarter would be little changed from the thirdquarter.&lt;/p&gt;
1 U.S. Broadband Penetration Tops 51,By ANICK JESDANUN    NEW YORK (AP) -- The number of Americans who get on the Internet via high-speed lines has now equaled the number using dial-up connections.    July measurements from Nielsen/NetRatings placed the broadband audience at 51 percent of the U.S...
1 Ecuadorean Lawsuit Vs Texaco Boils Down to Science (Reuters),Reuters - After a decade\of court battles, lawyers on Wednesday took a lawsuit by\Ecuadorean Indians accusing U.S. oil firm ChevronTexaco Corp..\of polluting the Amazon jungle into the field.
1 Priceline, Ramada to Make Sites More Accessible to Blind,In one of the first enforcement actions of the Americans with Disabilities Act on the Internet, two major travel services have agreed to make sites more accessible to the blind and visually impaired.
1 Court: File-swapping software not liable for copyright violations,The makers of two leading file-sharing programs are not legally liable for the songs, movies and other copyright works swapped online by their users, a federal appeals court ruled Thursday in a stinging blow to the entertainment industry. 
1 Ohio Sues Best Buy, Alleging Used Sales (AP),AP - Ohio authorities sued Best Buy Co. Inc. on Thursday, alleging the electronics retailer engaged in unfair and deceptive business practices.
1 Cisco Flaw Leaves Router Vulnerable to Attack,Cisco Systems issued a security advisory warning that some networks using its routers may be vulnerable to denial-of-service attacks. Devices running Internetwork Operating System and enabled for the open shortest path first (OSPF) ...
1 Briefly: China interest in key Yukos unit,China is interested in participating in the bidding for Yuganskneftegaz, the top oil-producing subsidiary of the Russian oil giant Yukos, a Chinese economic official was quoted as saying in a report Thursday by the Russian news agency Interfax. The ...
1 Apple recalls 28,000 batteries,APPLE has issued a safety recall for 28,000 batteries for its Powerbook notebooks, saying they posed a potential fire hazard. 
1 Best Buy a Bad Deal?,Attorney General Jim Petro is suing Best Buy, alleging the electronics retailer has engaged in unfair and deceptive business practices. 
1 Iraq Oil Exports Still Halved After Basra HQ Attack, BAGHDAD (Reuters) - Iraq continued to export oil at one  million barrels per day on Friday after an attack on the South  Oil Company headquarters took sabotage operations to a new  level, an official at the state-owned entity said.
1 US unemployment claims slip but picture still murky,NEW YORKFewer Americans lined up to claim first-time jobless benefits last week but analysts said the modest decline said very little about the current state of the labour market. 
1 Vt. sues over importing drugs,Vermont's Republican governor challenged the Bush administration's prescription drug policy in federal court yesterday, marking the first time a state has chosen a legal avenue in the expanding battle over Canadian imports.
1 P2P Services in the Clear,In a major setback for the music and movie industries, a federal appeals court upholds a lower court's decision in the infamous Grokster case, ruling peer-to-peer services Morpheus and Grokster are not liable for the copyright infringement of their users. By Katie Dean.
1 Producer sues for Rings profits,Hollywood producer Saul Zaentz sues the producers of The Lord of the Rings for \$20m in royalties.
1 Google scores first-day bump of 18 (USATODAY.com),USATODAY.com - Even a big first-day jump in shares of Google (GOOG) couldn't quiet debate over whether the Internet search engine's contentious auction was a hit or a flop.
1 ChevronTexaco hit with \$40.3M ruling,Montana jury orders oil firm to pay up over gas pipeline leak from 1955; company plans to appeal. NEW YORK (Reuters) - A Montana jury ordered ChevronTexaco Corp., the number two US oil company, to pay \$40.3 million for environmental damage from a gasoline ...
1 Before-the Bell; Rouse Co. Shares Jump, &lt;A HREF=http://www.investor.reuters.com/FullQuote.aspx?ticker=RSE.N target=/stocks/quickinfo/fullquote&gt;RSE.N&lt;/A&gt; jumped before the bell after General Growth  Properties Inc. &lt;A HREF=http://www.investor.reuters.com/FullQuote.aspx?ticker=GGP.N target=/stocks/quickinfo/fullquote&gt;GGP.N&lt;/A&gt;, the No. 2 U.S. shopping mall owner, on  Friday said it would buy Rouse for \$7.2 billion.
1 Services make big gains in Japan,Tertiary index comes in at almost double expectations, drives up yen and helps Nikkei overcome oil. LONDON (Reuters) - The yen hit a four-week high against the dollar Friday as stronger-than-expected Japanese service sector data raised optimism about the ...
1 Google shares bounce up 18 in trading debut,In the stock #39;s first day of trading, investors bought, sold and flipped shares at a furious pace, with the price ending just above \$100 - 18 percent higher than where it started. It was, in other words, everything the company #39;s founders, Sergy Brin and ...
1 Stocks Lower as Oil Prices Steam Higher,With the much-ballyhooed initial public offering of Google behind them and oil chugging to a new record high, investors took a step back today.
1 Understanding Google AdWords,Understanding Google AdWords\\Unlike many search engines Google, to its credit, clearly denotes search listings that are paid placement. In fact, Google AdWords appear in a separate section down the left side of the screen.\\Google AdWords provide an inexpensive advertising venue for businesses to advertise products or services to a targeted ...
1 Service packs, senators and civil liberties,&lt;strong&gt;Letters:&lt;/strong&gt; The bulging postbag gives up its secrets
1 Hooker Furniture Puts Investors First,Closing a factory is never popular, but it's the right thing to do.
1 Clicking on Profits,The latest data from the US Department of Commerce further bolsters what we have all suspected: E-commerce sales are increasing. Not only might one suspect that consumer confidence has been bolstered since last year, there ...
1 Antidepressants to Reflect Suicide Risk, WASHINGTON (Reuters) - The U.S. Food and Drug  Administration plans to update antidepressant labels to reflect  studies that suggest a link between the drugs and suicide in  youths, but remains cautious about the strength of such ties,   according to documents released on Friday.
1 Crude Price Spike May Send Gas Higher (AP),AP - Amid soaring crude oil prices, gasoline costs have been dropping. But don't expect that to last, economists say.
1 Amazon Snaps Up China's Largest Web Retailer (NewsFactor),NewsFactor - Amazon.com (Nasdaq: AMZN) has said it will buy Joyo.com Limited -- a British Virgin Islands company that operates the largest Internet retail Web site in China -- for US #36;75 million.
1 Court Won't Halt Arch Coal's Triton Bid (Reuters),Reuters - A U.S. appeals court ruled on Friday\that Arch Coal Inc. (ACI.N) may proceed with its bid to buy the\assets of rival Triton Coal Co. LLC, denying an emergency\request by the Federal Trade Commission to block the deal, a\spokesman for the agency said.
1 Treasury Prices Take a Breather Today, NEW YORK (Reuters) - U.S. Treasury prices paused for breath  on Tuesday after a blistering two-session rally ran out of  steam, though analysts still saw room to the upside given the  large short-base in the market.
1 Report: Consumers tuning in to plasma TVs,First-quarter shipments of plasma televisions in the United States more than doubled from the previous year, according to research firm iSuppli. Prices fell by nearly \$1,000 over the same period. 
1 One in four servers to run Linux by 2008,In a report, the research firm painted a bright future for the open source operating system, claiming that shipments of servers running Linux -- and revenues from those shipments -- will rise significantly over the next five years.
1 Apple Recalls Flaming 15-inch PowerBook G4 Battery,The affected batteries could overheat, posing a fire hazard. Apple received four reports of these batteries overheating. No injuries have been reported.
1 Samsung plans to invest Won25,000bn in chips,Samsung Electronics, the world #39;s second largest computer chip manufacturer, yesterday said that it would invest Won25,000bn (\$24bn) in its semiconductor business by 2010 to generate 
1 Video Game Makers Go Hollywood. Uh-Oh.,OVIE producers are often criticized for running at the sight of original ideas, preferring instead to milk plays, books, news events, toys and even video games for their screenplays.
1 Amazon to Buy Chinese Retailer Joyo.com,Internet retailer Amazon.com Inc. said on Thursday that it will buy Joyo.com Ltd., which runs some of China #39;s biggest retail Web sites, for about \$75 million to gain entry into China #39;s fast-growing market.
1 Salesforce.com 2Q Profit Up Sharply,Software developer Salesforce.com Inc. posted a sharp rise in second-quarter profit on better-than-expected revenue during its first quarter as a public company, but investors shunned the stock in late trading 
1 Ready to Bet on Alternative Energy? Well, Think Again,When oil prices rise, public interest in alternative energy often does, too. But the logic is evidently escaping Wall Street.
1 China confronts lack of pipelines,China will spend about \$3.4 billion over two to three years laying thousands of miles of oil pipelines to help secure its energy supply in the face of soaring prices and demand.
1 Colgate to cut workforce,CONSUMER goods maker Colgate-Palmolive said today it would cut about 12 per cent of its 37,000-person work force and close a third of its factories worldwide as part of a four-year restructuring.
1 PRESS START FOR NOSTALGIA,Like Led Zeppelin #39;s  #39; #39;Stairway to Heaven #39; #39; and Lynyrd Skynyrd #39;s  #39; #39;Freebird, #39; #39; classic video games like Frogger and Pong can bring back an entire era.
1 Oil prices look set to dominate,The price of oil looks set to grab headlines as analysts forecast that its record-breaking run may well continue.
1 Agency reports climate change major problem,Rising sea levels, disappearing glaciers in the Alps and more deadly heat waves are coming for Europeans because of global warming, Europes environmental agency warned Wednesday.
1 Will High Oil Prices Lead to Recession? (AP),AP - High oil prices, which have been a factor in virtually all U.S. recessions over the past three decades, are surging again this year. And the higher crude oil prices climb, the more risk energy costs pose to what, until recently, many expected to be a banner year for the U.S. economy.
1 Indexes in Japan fall short of hype,Japanese stocks have failed to measure up to an assessment made in April by Merrill Lynch #39;s chief global strategist, David Bowers, who said Japan was  quot;very much everyone #39;s favorite equity market.
1 Wiretapping on the Net: Who pays?,NEW YORK At first glance, it might seem like the simple extension of a standard tool in the fight against the bad guys. But in fact, wiretapping Internet phones to monitor criminals and terrorists is costly 
1 Nortel Downsizes Again,Aug. 23, 2004 (TheDeal.com) Problem-plagued Nortel Networks Corp. announced plans Thursday, Aug. 19, to eliminate an additional 3,500 jobs and fire seven more senior executives as the company labors to reinvent 
1 Nikkei briefly regains 11,000 level,TOKYO - Japan #39;s benchmark Nikkei stock index briefly recovered to the 11,000 level Monday morning on widespread buying prompted by advances in US shares last Friday.
1 HK walks out of 68-month deflation cycle, official,Hong Kong Financial Secretary Henry Tang said he believed Hong Kong has walked out of the consumer price deflation cycle that lingered for 68 months, according to the consumer price index trend in the past few years.
1 Oil prices,In terms of dollar value, of all the products in the world, nothing is traded more than oil. Crude oil traded above 47 dollars a barrel for the first time this week.
1 Productivity Growth Slowest in 2 Years (AP),AP - The productivity of America's workers grew at a 1.8 percent annual rate in the third quarter, the slowest pace in nearly two years, the government reported Tuesday.
1 Australia Airline Announces Fuel Surcharge,Australian budget airline Virgin Blue announced Monday it will increase the fuel surcharge it adds to ticket prices from Aug. 26 because of soaring oil prices.
1 ARM agrees to buy Artisan Components for \$903 mn,LONDON, August 23 (New Ratings) - ARM Holdings (ARM.ETR) has agreed to buy Artisan Components Inc (ARTI), a US-based provider of integrated circuit designing solutions, for about \$913 million (503.
1 Dollar Bounces; Eye on Data, Greenspan, LONDON (Reuters) - The dollar bounced off recent four-week  lows against the euro and yen on Monday in thin August trade  with investors focusing on U.S. data and a speech by the  Federal Reserve chief later in the week.
1 Stopping spam at the source,New antispam technology standards are on the way that promise to hit spammers where it hurts the most--their wallets. At issue is the ability to authenticate the original source of e-mail messages, a major 
1 New Fat-Busting Microwave Oven Unveiled, TOKYO (Reuters) - Eyeing up that juicy steak but worried  about your waistline? Japanese electronics maker Sharp Corp.  &lt;A HREF=http://www.reuters.co.uk/financeQuoteLookup.jhtml?ticker=6753.T qtype=sym infotype=info qcat=news&gt;6753.T&lt;/A&gt; says it has developed a new fat-busting microwave oven  that can melt some of your worries away.
1 Kmart to Sell 18 Stores to Home Depot, NEW YORK (Reuters) - Retailer Kmart Holdings Corp. &lt;A HREF=http://www.investor.reuters.com/FullQuote.aspx?ticker=KMRT.O target=/stocks/quickinfo/fullquote&gt;KMRT.O&lt;/A&gt;  on Monday said it finalized a deal to sell 18 of its stores to  Home Depot Inc. &lt;A HREF=http://www.investor.reuters.com/FullQuote.aspx?ticker=HD.N target=/stocks/quickinfo/fullquote&gt;HD.N&lt;/A&gt; for \$271 million.
1 Students crazy about iPod follow the music to Apple laptops (USATODAY.com),USATODAY.com - Apple's trendy iPod digital music player, which has revitalized the company, is giving laptop sales a boost during back-to-school season.
1 Does Nick Carr matter?,Strategybusiness concludes that a controversial new book on the strategic value of information technology is flawed--but correct.\
1 Students Pay More for Beer Than Books,British students spend about \$1.8 billion on drink every year, nearly three times as much as they cough up for books, a survey released on Monday showed.
1 Leeds students figure high on working curve,Undergraduates in the city earn more than 90 a week on average, just behind Glasgow, Cambridge and Cardiff. Their hard-earned cash is likely to be spent on looking good and socialising, the 
1 Windows Upgrade Causing Campus Headaches,Microsoft Corp. #39;s decision to release a major upgrade for its flagship operating system in the same month that hundreds of thousands of students are reporting to college campuses across the 
1 Intel cuts Pentium 4 prices,The newest P4 chips drop in price by 18 percent to 35 percent; a host of other chips are cheaper now as well.
1 Northrop Grumman Gets \$408 Million Pact,Defense contractor Northrop Grumman Corp. on Monday said it received a 10-year, \$408 million Army contract to provide simulated battle command training support to Army corps commanders - the latest award in 
1 Record biz hammers  #39;ostrich #39; downloaders,The music industry in the US is making great strides in its campaign against people it says have illegally downloaded music, with courts awarding huge settlements in many cases.
1 Oil price down as Iraq fears ease,The price of oil has fallen as fears about interruptions to supplies being pumped out of Iraq eased slightly.
1 Obesity Solution: Nuke It,Eying that juicy steak but worried about your waistline? Sharp says it has developed a new fat-busting microwave oven that can melt some of your worries away.
1 E-commerce still booming,Online retail sales continue to show significant growth, according to the latest figures released by the US Department of Commerce.
1 Lycos offers people and discussion search,Terra Lycos SA introduced two search tools on its Lycos U.S. Internet site on Monday as part of a recently announced strategy to focus on services that allow users to connect with others.
1 Oil Eases as Iraq Resumes Exports,&lt;p&gt;\&lt;/p&gt;&lt;p&gt; By Andrew Mitchell&lt;/p&gt;&lt;p&gt; LONDON (Reuters) - High-flying oil prices eased for a\second session on Monday as Iraq resumed exports from both its\northern and southern outlets after lengthy disruption, despite\fierce fighting in the holy city of Najaf.&lt;/p&gt;
1 Blue Chips Unchanged, Wal-Mart Weighs, NEW YORK (Reuters) - U.S. blue chips were near the  unchanged mark on Monday as a disappointing sales forecast from  retailer Wal-Mart Stores Inc. &lt;A HREF=http://www.investor.reuters.com/FullQuote.aspx?ticker=WMT.N target=/stocks/quickinfo/fullquote&gt;WMT.N&lt;/A&gt; dampened sentiment,  offsetting the benefit of easing oil prices.
1 Wiretaps may mute Nextel rivals,Fed up with technical excuses, FBI wants carriers to support eavesdropping capabilities for push-to-talk technology now.
1 Partnership Connects Wi-Fi Users In The Sky,Wi-Fi is going sky-high thanks to a deal forged between enterprise Internet service provider iPass and Connexion by Boeing. Under the deal, iPass #39;s 528,000-plus Wi-Fi enterprise customers will 
1 EDS Is Charter Member of Siebel BPO Alliance (NewsFactor),NewsFactor - Siebel Systems (Nasdaq: SEBL) has named EDS as the charter partner in Siebels' new business process outsourcing (BPO) global strategic-alliance program. The agreement expands the relationship between EDS and Siebel to provide a set of high-value managed products and service offerings targeted at the BPO and customer relationship management (CRM) marketplaces.
1 Philippine President Says Country Faces Fiscal Crisis,Philippine president Gloria Arroyo warned that her country is in the midst of a fiscal crisis. A report by economists at the University of the Philippines said the country faces economic collapse 
1 Obesity Raises Risk for 9 Different Types of Cancer,By LAURAN NEERGAARD    WASHINGTON (AP) -- Heart disease and diabetes get all the attention, but expanding waistlines increase the risk for at least nine types of cancer, too. And with the obesity epidemic showing no signs of waning, specialists say they need to better understand how fat cells fuels cancer growth so they might fight back...
1 Credit Card Delinquencies at a 4-Year Low, NEW YORK (Reuters) - Americans paid their credit card bills  on time at a record high level in June, sending credit card  delinquencies to their lowest level in four years, Moody's  Investors Service said on Monday.
1 Deal has S2io champing at the gigabit,OTTAWA -- A local firm that says it can help shrink backup times at large data centres is growing its business thanks to an alliance with Sun Microsystems Inc.
1 Microsoft: Use Script to Block Windows XP SP2 Updates,Microsoft has offered up yet another way for businesses to block the automatic update of Windows XP to the big-deal Service Pack 2 (SP2) upgrade.
1 Cisco Buys IP Platform Maker,Network equipment giant Cisco Systems (Quote, Chart) is buying IP platform specialist P-Cube for \$200 million in cash and stock. P-Cube #39;s technology helps telecom carriers, cable operators and ISPs manage 
1 SAP Gets \$35 Million Post Office Pact,SAP has landed a \$35 million deal to help the US Postal Service overhaul its human resources systems. According to sources close to the deal, the agreement includes a \$21 million consulting component, and 
1 Intel drops prices on computer chips,SAN FRANCISCO - Intel Corp. has cut prices on its computer chips by as much as 35 percent, though analysts on Monday said the cuts were probably unrelated to swelling inventories of the world #39;s largest chip maker.
1 Dollar Holds Gains, Fed Comments Help, TOKYO (Reuters) - The dollar held on to the previous day's  gain on Tuesday, supported by a retreat in oil prices and  upbeat comments on the U.S. economy from Federal Reserve  officials.
1 SAP Awarded \$35 Million Postal Service Contract,The postal service, which employs more than a third of the civilian employees of the federal government, chose SAP after a multi-year evaluation, it said.
1 Dark arts of spin evident in phoney war for Abbey,THE phoney war over the fate of Abbey grinds on. Along the way, on all sides, it is producing its predictable crop of knowing winks and destabilising nudges.
1 Dollar Keeps Gains as Market Awaits Data, TOKYO (Reuters) - The dollar idled on Tuesday after gaining  the previous day, as many investors held off building positions  ahead of economic data from the United States.
1 Johnson  amp; Johnson bids for rival,NEW YORK Johnson  amp; Johnson is in advanced negotiations to acquire Guidant, one of the largest US makers of devices to treat heart and circulatory illnesses, according to executives close to the talks.
1 Yukos warns it oil output is lagging,Beleaguered Russian energy giant Yukos has warned that it will not produce as much oil as expected this year. It blames bailiffs who are draining its bank accounts to pay its potentially ruinous tax bill.
1 No IE? No Can See,One thing that #39;s always irritated those who don #39;t choose to use Internet Explorer is finding a website that requires IE. Such complaints seem to have grown all the more passionate now security concerns are driving more users to consider IE alternatives.
2 Fears for T N pension after talks,Unions representing workers at Turner   Newall say they are 'disappointed' after talks with stricken parent firm Federal Mogul.
2 The Race is On: Second Private Team Sets Launch Date for Human Spaceflight (SPACE.com),SPACE.com - TORONTO, Canada -- A second\team of rocketeers competing for the  #36;10 million Ansari X Prize, a contest for\privately funded suborbital space flight, has officially announced the first\launch date for its manned rocket.
2 Ky. Company Wins Grant to Study Peptides (AP),AP - A company founded by a chemistry researcher at the University of Louisville won a grant to develop a method of producing better peptides, which are short chains of amino acids, the building blocks of proteins.
2 Calif. Aims to Limit Farm-Related Smog (AP),AP - Southern California's smog-fighting agency went after emissions of the bovine variety Friday, adopting the nation's first rules to reduce air pollution from dairy cow manure.
2 Super ant colony hits Australia,A giant 100km colony of ants  which has been discovered in Melbourne, Australia, could threaten local insect species.
2 Scientists Discover Ganymede has a Lumpy Interior,Jet Propulsion Lab -- Scientists have discovered irregular lumps beneath the icy surface of Jupiter's largest moon, Ganymede. These irregular masses may be rock formations, supported by Ganymede's icy shell for billions of years...
2 Mars Rovers Relay Images Through Mars Express,European Space Agency -- ESAs Mars Express has relayed pictures from one of NASA's Mars rovers for the first time, as part of a set of interplanetary networking demonstrations.     The demonstrations pave the way for future Mars missions to draw on joint interplanetary networking capabilities...
2 Rocking the Cradle of Life,When did life begin? One evidential clue stems from the fossil records in Western Australia, although whether these layered sediments are biological or chemical has spawned a spirited debate. Oxford researcher, Nicola McLoughlin, describes some of the issues in contention.
2 Sister of man who died in Vancouver police custody slams chief (Canadian Press),Canadian Press - VANCOUVER (CP) - The sister of a man who died after a violent confrontation with police has demanded the city's chief constable resign for defending the officer involved.
2 Man Sought  #36;50M From McGreevey, Aides Say (AP),AP - The man who claims Gov. James E. McGreevey sexually harassed him was pushing for a cash settlement of up to  #36;50 million before the governor decided to announce that he was gay and had an extramarital affair, sources told The Associated Press.
